{
  "schema_version": "1.3.0",
  "release_id": "2026-presidente-20261029T023119Z",
  "published_at": "2026-10-29T02:31:19Z",
  "release_base": "releases/2026-presidente-20261029T023119Z/",
  "catalog_url": "releases/2026-presidente-20261029T023119Z/catalogo.json",
  "pipeline_git_sha": "d7cf8e2f59691d9f4944a57f97626424ba92679a",
  "method_version": "metodo-1.0.0"
}
